[
  {
    "id": "hsk1-0151",
    "level": 1,
    "simplified": "牛奶",
    "traditional": "牛奶",
    "pinyin": "niúnǎi",
    "pinyinNumbered": "niu2 nai3",
    "tones": [
      2,
      3
    ],
    "english": "milk; cow's milk",
    "partOfSpeech": "noun",
    "myanmar": {
      "meaning": "နွားနို့",
      "kidExplanation": "牛奶 ဆိုတာ နွားနို့ပါ။ ကလေးတွေ ကြီးထွားဖို့ နေ့တိုင်း သောက်ကြတယ်နော်။",
      "pronunciationTip": "\"နိယို နိုင်\" လို့ ပြောပါ။ \"နိ\" နဲ့ \"ယို\" ကို တစ်ချက်တည်း မြန်မြန် ဆက်ပြောပါ။",
      "memoryTip": "牛 = နွား၊ 奶 = နို့။ နွားရဲ့ နို့ = 牛奶။ 牛 ကို ကြည့်ပါ — ချိုပါတဲ့ နွားခေါင်းပုံကနေ လာတာပါ။",
      "usageNote": "喝牛奶 (နွားနို့ သောက်တယ်)။",
      "commonMistake": "牛奶 ကို 吃 နဲ့ မတွဲပါနဲ့ — 喝牛奶 ပါ။"
    },
    "examples": [
      {
        "zh": "我早上喝牛奶。",
        "pinyin": "Wǒ zǎoshang hē niúnǎi.",
        "my": "ကျွန်တော် မနက်ဆို နွားနို့ သောက်တယ်။",
        "audio": null
      },
      {
        "zh": "牛奶在桌子上。",
        "pinyin": "Niúnǎi zài zhuōzi shang.",
        "my": "နွားနို့က စားပွဲပေါ်မှာ။",
        "audio": null
      }
    ],
    "relatedWords": [
      "喝",
      "水"
    ],
    "audio": {
      "word": null
    },
    "workbookRefs": [],
    "reviewStatus": "draft"
  },
  {
    "id": "hsk1-0152",
    "level": 1,
    "simplified": "女",
    "traditional": "女",
    "pinyin": "nǚ",
    "pinyinNumbered": "nv3",
    "tones": [
      3
    ],
    "english": "female",
    "partOfSpeech": "adjective",
    "myanmar": {
      "meaning": "မိန်းမ၊ အမ",
      "kidExplanation": "女 ဆိုတာ မိန်းမ၊ မိန်းကလေး ပါ။ 男 (ယောက်ျား) ရဲ့ ဆန့်ကျင်ဘက်ပါ။",
      "pronunciationTip": "\"နွီ\" လို့ ပြောပါ။ ü က \"ယူ\" မဟုတ်ပါ — \"အီ\" လို့ ပြောရင်း နှုတ်ခမ်းကို လုံးလိုက်ပါ။",
      "memoryTip": "女 က ဒူးထောက်ထိုင်ပြီး လက်ကို ယှက်ထားတဲ့ မိန်းမပုံကနေ လာတာပါ။ 妈၊ 姐၊ 妹 မှာ 女 ပါတာ သတိထားမိလား?",
      "usageNote": "女 + နာမ်: 女同学 (မိန်းကလေး အတန်းဖော်)။ \"မိန်းမပါ\" ဆိုရင် 是女的 လို့ ပြောပါ။",
      "commonMistake": "女 (nǚ) ကို \"နူ\" လို့ မထွက်ပါနဲ့ — ü အသံပါ။"
    },
    "examples": [
      {
        "zh": "那个女孩子是我妹妹。",
        "pinyin": "Nàge nǚ háizi shì wǒ mèimei.",
        "my": "ဟိုမိန်းကလေးက ကျွန်တော့် နှမလေးပါ။",
        "audio": null
      },
      {
        "zh": "我们学校的老师都是女的。",
        "pinyin": "Wǒmen xuéxiào de lǎoshī dōu shì nǚ de.",
        "my": "ကျွန်မတို့ ကျောင်းက ဆရာတွေ အားလုံး ဆရာမတွေပါ။",
        "audio": null
      }
    ],
    "relatedWords": [
      "男",
      "女儿",
      "女士"
    ],
    "audio": {
      "word": null
    },
    "workbookRefs": [],
    "reviewStatus": "draft"
  },
  {
    "id": "hsk1-0153",
    "level": 1,
    "simplified": "女儿",
    "traditional": "女兒",
    "pinyin": "nǚ’ér",
    "pinyinNumbered": "nv3 er2",
    "tones": [
      3,
      2
    ],
    "english": "daughter",
    "partOfSpeech": "noun",
    "myanmar": {
      "meaning": "သမီး",
      "kidExplanation": "女儿 ဆိုတာ အဖေ အမေရဲ့ \"သမီး\" ပါ။ သားဆိုရင် 儿子 ပါ။",
      "pronunciationTip": "\"နွီ အာရ်\" လို့ ပြောပါ။ ü က \"ယူ\" မဟုတ်ပါ — \"အီ\" လို့ ပြောရင်း နှုတ်ခမ်းကို လုံးလိုက်ပါ။ ér ကို လျှာဖျားလေးကို နောက်ကို ကော့ပြီး ပြောပါ။",
      "memoryTip": "女 (မိန်းကလေး) + 儿 (ကလေး) = မိန်းကလေး ကလေး = သမီး!",
      "usageNote": "",
      "commonMistake": "女儿 (သမီး) နဲ့ 儿子 (သား) — 儿 ပါတာချင်း တူပေမဲ့ အစီအစဉ် ပြောင်းပြန်ပါ။"
    },
    "examples": [
      {
        "zh": "他们有一个女儿。",
        "pinyin": "Tāmen yǒu yí ge nǚ'ér.",
        "my": "သူတို့မှာ သမီး တစ်ယောက် ရှိတယ်။",
        "audio": null
      },
      {
        "zh": "我女儿今年八岁。",
        "pinyin": "Wǒ nǚ'ér jīnnián bā suì.",
        "my": "ကျွန်တော့် သမီး ဒီနှစ် ရှစ်နှစ် ရှိပြီ။",
        "audio": null
      }
    ],
    "relatedWords": [
      "儿子",
      "孩子"
    ],
    "audio": {
      "word": null
    },
    "workbookRefs": [],
    "reviewStatus": "draft"
  },
  {
    "id": "hsk1-0154",
    "level": 1,
    "simplified": "女朋友",
    "traditional": "女朋友",
    "pinyin": "nǚpéngyou",
    "pinyinNumbered": "nv3 peng2 you5",
    "tones": [
      3,
      2,
      5
    ],
    "english": "girlfriend",
    "partOfSpeech": "noun",
    "myanmar": {
      "meaning": "ချစ်သူ (မိန်းကလေး)",
      "kidExplanation": "女朋友 ဆိုတာ ယောက်ျားလေး တစ်ယောက်ရဲ့ ချစ်သူ မိန်းကလေးပါ။ ရိုးရိုး မိန်းကလေး သူငယ်ချင်းကိုတော့ 朋友 လို့ပဲ ပြောပါ။",
      "pronunciationTip": "\"နွီ ဖန်-ယို\" လို့ ပြောပါ။ ü က \"ယူ\" မဟုတ်ပါ — \"အီ\" လို့ ပြောရင်း နှုတ်ခမ်းကို လုံးလိုက်ပါ။ p က \"ဖ\" လို လေထွက်တဲ့ အသံပါ။",
      "memoryTip": "女 (မိန်းကလေး) + 朋友 (သူငယ်ချင်း) = မိန်းကလေး ချစ်သူ။",
      "usageNote": "",
      "commonMistake": "မိန်းကလေး သူငယ်ချင်း ရိုးရိုးကို 女朋友 လို့ မခေါ်ပါနဲ့ — ချစ်သူ ဖြစ်သွားပါလိမ့်မယ်!"
    },
    "examples": [
      {
        "zh": "我哥哥有女朋友。",
        "pinyin": "Wǒ gēge yǒu nǚpéngyou.",
        "my": "ကျွန်တော့် အစ်ကိုမှာ ချစ်သူ ရှိတယ်။",
        "audio": null
      },
      {
        "zh": "他的女朋友是老师。",
        "pinyin": "Tā de nǚpéngyou shì lǎoshī.",
        "my": "သူ့ချစ်သူက ဆရာမပါ။",
        "audio": null
      }
    ],
    "relatedWords": [
      "男朋友",
      "朋友"
    ],
    "audio": {
      "word": null
    },
    "workbookRefs": [],
    "reviewStatus": "draft"
  },
  {
    "id": "hsk1-0155",
    "level": 1,
    "simplified": "女士",
    "traditional": "女士",
    "pinyin": "nǚshì",
    "pinyinNumbered": "nv3 shi4",
    "tones": [
      3,
      4
    ],
    "english": "lady; madam; Ms.",
    "partOfSpeech": "noun",
    "myanmar": {
      "meaning": "အမျိုးသမီး၊ ဒေါ် (ယဉ်ကျေးစွာ)",
      "kidExplanation": "女士 ဆိုတာ အမျိုးသမီးတွေကို ယဉ်ယဉ်ကျေးကျေး ခေါ်တဲ့ စကားလုံးပါ — မြန်မာလို \"ဒေါ်\" လိုမျိုးပေါ့။ 王女士 = ဒေါ်ဝမ်။",
      "pronunciationTip": "\"နွီ ရှီ\" လို့ ပြောပါ။ ü က \"ယူ\" မဟုတ်ပါ — \"အီ\" လို့ ပြောရင်း နှုတ်ခမ်းကို လုံးလိုက်ပါ။ sh ကို လျှာဖျားကို အပေါ်ကို ကော့ပြီး ပြောပါ။",
      "memoryTip": "女 (မိန်းမ) + 士 (ပုဂ္ဂိုလ်) = အမျိုးသမီး ပုဂ္ဂိုလ်။",
      "usageNote": "မျိုးရိုးနာမည် + 女士: 李女士။ အမျိုးသားဆိုရင် 先生 (xiānsheng) ပါ။",
      "commonMistake": ""
    },
    "examples": [
      {
        "zh": "女士们，先生们，你们好！",
        "pinyin": "Nǚshìmen, xiānshengmen, nǐmen hǎo!",
        "my": "အမျိုးသမီးများ၊ အမျိုးသားများ မင်္ဂလာပါ။",
        "audio": null
      },
      {
        "zh": "那个女士是谁？",
        "pinyin": "Nàge nǚshì shì shéi?",
        "my": "ဟိုအမျိုးသမီးက ဘယ်သူလဲ။",
        "audio": null
      }
    ],
    "relatedWords": [
      "先生",
      "女"
    ],
    "audio": {
      "word": null
    },
    "workbookRefs": [],
    "reviewStatus": "draft"
  },
  {
    "id": "hsk1-0156",
    "level": 1,
    "simplified": "朋友",
    "traditional": "朋友",
    "pinyin": "péngyou",
    "pinyinNumbered": "peng2 you5",
    "tones": [
      2,
      5
    ],
    "english": "friend",
    "partOfSpeech": "noun",
    "myanmar": {
      "meaning": "သူငယ်ချင်း",
      "kidExplanation": "朋友 ဆိုတာ သူငယ်ချင်းပါ။ အတူ ကစား၊ အတူ စာလုပ်တဲ့ သူတွေပေါ့။",
      "pronunciationTip": "\"ဖန်-ယို\" လို့ ပြောပါ။ p က \"ဖ\" လို လေထွက်တဲ့ အသံပါ။",
      "memoryTip": "朋 ကို ကြည့်ပါ — 月 နှစ်လုံး ယှဉ်လျက်။ သူငယ်ချင်း နှစ်ယောက် ပခုံးချင်းယှဉ်ပြီး လျှောက်နေသလိုပဲ!",
      "usageNote": "好朋友 (သူငယ်ချင်းကောင်း)။",
      "commonMistake": ""
    },
    "examples": [
      {
        "zh": "他是我的好朋友。",
        "pinyin": "Tā shì wǒ de hǎo péngyou.",
        "my": "သူက ကျွန်တော့် သူငယ်ချင်းကောင်းပါ။",
        "audio": null
      },
      {
        "zh": "我和朋友去看电影。",
        "pinyin": "Wǒ hé péngyou qù kàn diànyǐng.",
        "my": "ကျွန်မ သူငယ်ချင်းနဲ့ ရုပ်ရှင်ကြည့်သွားတယ်။",
        "audio": null
      }
    ],
    "relatedWords": [
      "同学",
      "男朋友",
      "女朋友"
    ],
    "audio": {
      "word": null
    },
    "workbookRefs": [],
    "reviewStatus": "draft"
  },
  {
    "id": "hsk1-0157",
    "level": 1,
    "simplified": "便宜",
    "traditional": "便宜",
    "pinyin": "piányi",
    "pinyinNumbered": "pian2 yi5",
    "tones": [
      2,
      5
    ],
    "english": "cheap; inexpensive",
    "partOfSpeech": "adjective",
    "myanmar": {
      "meaning": "ဈေးပေါတယ်",
      "kidExplanation": "便宜 ဆိုတာ ဈေးပေါတာ၊ ပိုက်ဆံ နည်းနည်းပဲ ပေးရတာပါ။ 贵 (ဈေးကြီးတယ်) ရဲ့ ဆန့်ကျင်ဘက်ပါ။",
      "pronunciationTip": "\"ဖျန်-ယိ\" လို့ ပြောပါ။ p က \"ဖ\" လို လေထွက်တဲ့ အသံပါ။",
      "memoryTip": "宜 ရဲ့ အပေါ်မှာ 宀 (အမိုး) ပါတယ်။ ဈေးပေါတဲ့ ပစ္စည်းတွေကို အိမ်ထဲ သယ်လာတယ်လို့ ပုံဖော်ပါ။",
      "usageNote": "很便宜 / 太便宜了！ ဈေးဆစ်ချင်ရင် 便宜一点儿吧！ လို့ ပြောပါ။",
      "commonMistake": "便 ကို biàn လို့ မဖတ်ပါနဲ့ — 便宜 မှာ pián ပါ။"
    },
    "examples": [
      {
        "zh": "这个超市的水果很便宜。",
        "pinyin": "Zhège chāoshì de shuǐguǒ hěn piányi.",
        "my": "ဒီစူပါမားကက်က သစ်သီးတွေ ဈေးပေါတယ်။",
        "audio": null
      },
      {
        "zh": "便宜一点儿吧！",
        "pinyin": "Piányi yìdiǎnr ba!",
        "my": "နည်းနည်း လျှော့ပေးပါလား!",
        "audio": null
      }
    ],
    "relatedWords": [
      "贵",
      "钱",
      "买"
    ],
    "audio": {
      "word": null
    },
    "workbookRefs": [],
    "reviewStatus": "draft"
  },
  {
    "id": "hsk1-0158",
    "level": 1,
    "simplified": "漂亮",
    "traditional": "漂亮",
    "pinyin": "piàoliang",
    "pinyinNumbered": "piao4 liang5",
    "tones": [
      4,
      5
    ],
    "english": "pretty; beautiful",
    "partOfSpeech": "adjective",
    "myanmar": {
      "meaning": "လှတယ်",
      "kidExplanation": "漂亮 ဆိုတာ လှတာပါ။ လှတဲ့ မိန်းကလေး၊ လှတဲ့ အင်္ကျီ၊ လှတဲ့ ပန်းခြံ — အားလုံးမှာ သုံးလို့ရပါတယ်။",
      "pronunciationTip": "\"ဖျော်-လိယန်\" လို့ ပြောပါ။ p က \"ဖ\" လို လေထွက်တဲ့ အသံပါ။",
      "memoryTip": "漂 ရဲ့ ဘယ်ဘက်မှာ 氵 (ရေ) ပါတယ်။ ရေကန်ထဲမှာ ကြာပန်းလေး လှလှ ပေါ်နေတယ်လို့ ပုံဖော်ပါ။",
      "usageNote": "很漂亮 (အရမ်းလှတယ်)။",
      "commonMistake": "漂亮 (လှတယ်) နဲ့ 好看 (ကြည့်လို့ကောင်းတယ်) က အဓိပ္ပာယ် နီးပါတယ်။ ရုပ်ရှင်၊ စာအုပ် ကောင်းတာကိုတော့ 好看 ကို သုံးပါ။"
    },
    "examples": [
      {
        "zh": "这件衣服很漂亮。",
        "pinyin": "Zhè jiàn yīfu hěn piàoliang.",
        "my": "ဒီအင်္ကျီ အရမ်းလှတယ်။",
        "audio": null
      },
      {
        "zh": "你妹妹真漂亮！",
        "pinyin": "Nǐ mèimei zhēn piàoliang!",
        "my": "မင်းညီမလေး တကယ်လှတယ်!",
        "audio": null
      }
    ],
    "relatedWords": [